{
  "schema_version": "sensei.dashboard.agent-run.v1",
  "run_id": "run.o1.1",
  "job_id": "job.o1.1",
  "repository_domain": "github.com/globulario/sensei-dashboard",
  "governing_snapshot": {
    "repository_domain": "github.com/globulario/sensei-dashboard",
    "revision": "8a45f3f1e237a2e83352b01fcd417a3898efe2b4",
    "revision_status": "resolved",
    "tree_digest_sha256": "111111111111111111111111111111111111111111111111111111111111111b",
    "graph_digest_sha256": "222222222222222222222222222222222222222222222222222222222222222c",
    "graph_digest_status": "resolved"
  },
  "expected_head_sha": "9416f66713b74870b289e9025e4968876b32dae7",
  "worktree_id": "worktree.o1.1",
  "task_ref": { "issue_ref": null, "pr_ref": "pull/11", "task_id": "task.o1.governing-contracts" },
  "role": "implementer",
  "provider": { "provider_id": "claude-code", "runtime": "claude-code" },
  "assurance_mode": "governed",
  "required_capabilities": ["headless_execution", "mcp", "structured_output"],
  "operation_class": "mutation",
  "governing_contract_ref": {
    "brief_path": "docs/claude-workspace-o1-brief.md",
    "accepted_sha": "968fdc02b4f13f3b83ffbdd99ec1186d8466cf09"
  },
  "admission_reference": {
    "admission_id": "admission.9f8e7d",
    "decision": "admitted_with_conditions",
    "decision_digest_sha256": "333333333333333333333333333333333333333333333333333333333333333d",
    "policy_id": "policy.default"
  },
  "lifecycle_state": "running",
  "cancellation": null,
  "created_at": "2026-07-25T09:00:00Z",
  "updated_at": "2026-07-25T09:30:00Z"
}
